Date,Category ,Summary,Link 
2018-05-31,Progress Michigan ,"Michigan may be the hardest hit were a “trade war” between the US and China to erupt. A research analyst at the Brookings Institution in Washington stated this week - more than 91,000 Michigan jobs in industries, including auto-making, plastic product manufacturing and pharmaceuticals, could be lost if China were to stand by a tax threat made in April. On Tuesday, Trump said he is considering a 25% tariff on $50 billion worth of Chinese imports. ",https://www.freep.com/story/news/local/michigan/2018/05/30/chinese-trade-war-michigan-trump/654952002/
2018-05-31,Progress Michigan ,"During a visit from Betsy DeVos to a Grand Rapids public school on Tuesday, a student wore a transgender pride flag to deliver a message on protecting LGBTQ rights in schools. In 2017, DeVoc rescinded protections enacted under Obama allowing transgender studnets to use the school bathrooms that matched their gender identity. ",https://www.bustle.com/p/this-michigan-student-wore-a-transgender-pride-flag-to-meet-betsy-devos-it-sent-a-pointed-message-9249347
2018-05-31,LCV ,"Study released this week (""Canada's Profits, Michigans Risk"") shows that other existing pipelines in North America could sufficiently supply Michigan with oil if Line 5 is shut down. ",http://michiganradio.org/post/new-report-highlights-risks-enbridge-line-5-pipeline
2018-06-01,Progress Michigan ,"An employee of Progress Michigan has filed a lawsuit against Schuette, alleging the gubernatorial candidate has violated the state constitution and civil service rules by using his office for political patronage and his state employees for campaign purposes. A key accusation is that  Schuette loaded his taxpayer-funded office with Republican campaign activists in the run-up to his 2018 gubernatorial bid.",https://www.freep.com/story/news/local/michigan/2018/05/31/bill-schuette-lawsuit-campaign-governor/659001002/
2018-06-01,Michigan Gubernatorial Race,"Debate: Whitmer
-blasted Schuette for fighting a right-to-literacy lawsuit in court
-has a $3 billion plan to ""fix the damn roads,"" the money could come from approved bonding or tax raises 
-supported graduated income tax
-criticized current government for Flint and allowing Nestle to pump Michigan water 
-to bolster education on the state, need to stop redistributing money from School Aid Fund ","https://www.detroitnews.com/story/news/local/michigan/2018/05/31/michigan-governor-debate-mackinac-conference/661520002/

https://www.freep.com/story/news/local/michigan/2018/05/31/michigan-governors-debate/659011002/"
2018-06-01,Michigan Gubernatorial Race,"Debate: Schuette
-called Whitmer's plans for more taxes an ""economic collapse plan""
-supports repealing the state's wage law as part of a plan to fix infrastructure (use savings from not having to pay union wages)
-wants to rollback of the state income tax hike, from 4.25% to 3.9%
-frequently touted his supported from Trump 
-called for a review of the Michigan Department of Transportation
-expressed support for Medicaid work requirement 
-supports cutting auto insurance rates, claiming will help stimulate the economy","https://www.detroitnews.com/story/news/local/michigan/2018/05/31/michigan-governor-debate-mackinac-conference/661520002/

https://www.freep.com/story/news/local/michigan/2018/05/31/michigan-governors-debate/659011002/"
2018-06-01,Michigan Gubernatorial Race,"Debate
Some other key points from debate: 
-El-Sayed criticized the many lobbyists in the room, saying they paid off politicians to keep their taxes low
-Colbeck attacked El-Sayed again using islamophobic rhetoric 
-Calley calls education his ""number one priority""
-Flint was a recurring theme with El-Sayed and Thanedar using it as a symbol for the breakdown of trust in government",https://www.bridgemi.com/public-sector/flint-islam-and-fixing-damn-roads-your-michigan-governor-debate-recap
2018-06-01,Progress Michigan ,"More than 100 low-income voters went ahead with a protest yesterday outside Schuette's office. The group was protesting Schuette's campaign pledges to cut Michigan's Medicaid expansion. The cuts could affect nearly 700,000 people in Michigan who rely on Medicaid. ",https://www.wzzm13.com/article/news/local/michigan/low-income-workers-protest-bill-schuettes-opposition-to-medicaid/69-560488640
2018-06-04,Michigan Gubernatorial Race,"Dem: Thanedar
On Friday, the Michigan Board of State Canvassers rejected El-Sayed's challenge to Thanedar's voting signatures. El-Sayed had filed a grievance claiming that Thanedar's petition signatures contained a number of errors. ",https://www.freep.com/story/news/politics/2018/06/01/shri-thanedar-michigan-governor/663909002/
2018-06-04,Progress Michigan ,"New laws went into effect Friday that are aimed at reducing patient's risk of opioid addiction. Prescribers of drugs like Vicodin and morphine are now required to educate patients on the risks of addiction, and patients must sign a form saying they've been informed. They're also required to check a patients prescription history, meaning longer wait times. ",https://www.detroitnews.com/story/news/local/michigan/2018/05/31/new-michigan-opioid-laws/659603002/
2018-06-04,Progress Michigan ,"Tuesday is the deadline for the legislature to either move ahead on approving the legalization of recreational marijuana or to leave it up to voters in November. Supporters turned in more than 300,000 petition signatures to put the issue on the November ballot.  The initiative would legalize and regulate marijuana for recreational use for Michiganders over 21 years old.",http://michiganradio.org/post/marijuana-advocates-closely-watching-michigan-lawmakers-deadline-approaches
2018-06-04,LCV ,Snyder has voiced in an interview that fixes will only be temporary and Line 5 should eventually be de-commissioned. ,http://wkar.org/post/snyder-line-5-should-eventually-be-shut-down#stream/0
2018-06-04,Planned Parenthood,"More than a dozen governors have said they will take legal action against the Trump administration if they move ahead with cutting Title X funding to clinics. The governors sent a letter Thursday to the  Health and Human Services Secretary, emphasizing the importance of protecting Title X. ",https://abcnews.go.com/Politics/14-democratic-governors-sue-trump-administration-cuts-planned/story?id=55589431
2018-06-04,Planned Parenthood,"A ""yes means yes"" bill has been sponsored by a Michigan Democrat and is awaiting a house vote. The bill aims to introduce relationship violence and consent as mandatory topics in sex education in Michigan public schools. ",https://www.freep.com/story/news/local/michigan/2018/06/03/michigan-sex-ed-yes-consent-curriculum/667945002/
2018-06-05,LCV ,"Snyder's administration is in talks with Enbridge regarding a utility corridor (""the tunnel""). Enbridge is expected to submit an alternatives report by June 15th outlining potential costs, engineering considerations and environmental impacts. The Great Lakes Business Network has released a report outlining an alternative propane pipeline that would end before the straits. ",https://www.detroitnews.com/story/news/local/michigan/2018/06/05/michigan-utility-corridor-line-5/670067002/
2018-06-05,Progress Michigan ,Today is the deadline for  lawmakers to approve a proposal to legalize marijuana. If not approved today it will end up on the November ballot. ,https://www.detroitnews.com/story/news/local/michigan/2018/06/05/michigan-pot-legalization-deadline/672261002/
2018-06-05,Michigan Gubernatorial Race,"The Aug. 7 primary will be the first statewide election in which every city and township will use all new voting equipment that includes optical-scan ballot tabulators, accessible voting devices for voters with disabilities, and election-management and reporting software. 

",http://www.upmatters.com/news/local-news/michigan-upgrades-election-security-for-2018/1210153563
2018-06-05,Michigan Gubernatorial Race,"[Rep: Schuette] Schuette continues to use Granholm's legacy (Michigan governor before Snyder) as a campaign issue. Schuette is trying to associate Granholm with Whitmer and Calley, using them to contrast his stance on taxes and spending - positing himself as the ""jobs governor"" who will cut taxes. ",http://michiganradio.org/post/after-8-years-gop-control-schuette-wants-michiganders-re-visit-granholms-legacy
2018-06-05,Planned Parenthood,"Planned Parenthood has launched an online tracking tool called Tracking Trump. It outlines how the Trump-Pence administration is attacking people's reproductive and sexual health rights with a timeline of events, list of key players and descriptions of specific policies. It also has a chrome extension  to alert you of new events! ",https://www.trackingtrump.org/
2018-06-05,Progress Michigan ,"Michigan lawmakers could vote this week on a legislative initiative to eliminate the state's prevailing wage for public construction projects. Republican house members support the initiative, stating it will save taxpayer dollars on public projects - they are pushing to vote on it this week. Democrats are against the initiative as the state currently has labor shortages in the building trades. ",http://www.mlive.com/news/index.ssf/2018/06/michigan_lawmakers_poised_to_e.html#incart_river_index
2018-06-05,Progress Michigan ,Schools are closed for the day in a southwestern Michigan district after comments were overheard referencing violence against the school and graffiti referencing guns was found. The schools are scheduled to reopen Wednesday with increased police presence. ,https://www.detroitnews.com/story/news/local/michigan/2018/06/05/schools-closed-michigan-graffiti-guns-violence/35707773/
2018-06-06,Michigan Gubernatorial Race,[Rep: Schuette] Mike Pence is expected to attend a private fundraiser in Michigan this month for Schuette. The event is June 15th. ,https://www.detroitnews.com/story/news/local/michigan/2018/06/05/pence-bill-schuette-fundraiser-michigan/675249002/
2018-06-06,Progress Michigan ,Progress Michigan has made a site and story book detailing the ties between DeVoss and Schuette. Betsy DeVoss' organizations have donated $122K to Scheutte's campaign. ,https://www.metrotimes.com/news-hits/archives/2018/06/05/betsy-devos-orgs-donate-122k-to-bill-schuette-and-theres-a-childrens-book-about-them
2018-06-06,Progress Michigan ,"Legalization of marijuana is going to ballot this November, a win for marijuana advocates. If it had been approved through legislature yesterday, it would've been open to changes. ",https://www.rollingstone.com/culture/news/michigans-marijuana-law-w521129
2018-06-06,Progress Michigan ,House legislators are expected to vote today on eliminating the prevailing wage for public construction projects. It currently requires contractors to pay workers union wages and benefits for state-funded construction projects .Union groups have urged legislators to vote no on the repeal and put it on the ballot for November.,https://www.detroitnews.com/story/news/local/michigan/2018/06/05/prevailing-wage-repeal-plan-vote/674973002/
2018-06-06,Progress Michigan ,"Koch brothers are opposing Trump tariffs, investing millions in a multi-year campaign pushing the benefits of free trade. They are urging the Trump administration to lift the recent tariffs on aluminum and steel imports as well as proposed tariffs on imports from China. The brothers have spent millions supporting conservative policies but don't quite see eye-to-eye with Trump.  ",https://www.bbc.com/news/business-44366737
2018-06-06,Michigan Gubernatorial Race,"[Macomb Forum] Both El-Sayed and Thanedar will be participating the Macomb democratic gubernatorial forum Monday night, speaking about their platforms. Whitmer is unable to attend. A GOP forum is also taking place, but Schuette will not be in attendance. ",http://www.macombdaily.com/government-and-politics/20180605/whitmer-schuette-to-skip-macomb-gubernatorial-forums
2018-06-07,Michigan Gubernatorial Race,[Rep: Schuette] Republican leaders of Michigan House of Representatives and Senate have asked Schuette to give an opinion stating the Michigan Civil Rights Commission overstepped its authority when it states discrimination complaints should also cover the LGBT community. His office has not yet responded. ,https://www.freep.com/story/news/politics/2018/06/06/lgbt-bill-schuette-michigan-civil-rights-commission/679206002/
2018-06-07,Progress Michigan ,Medicaid work requirement approved by Michigan House. It would require Michiganders to work 80 hours a month in order to receive Medicaid. ,https://www.freep.com/story/news/local/michigan/2018/06/06/medicaid-recipients-would-have-work-80-hours-month-under-bill/676634002/
2018-06-07,Progress Michigan ,Michigan Republicans repealed the prevailing wage law yesterday (for public construction projects). The vote was opposed by Democrats and union-backed labor groups. ,https://www.bridgemi.com/public-sector/michigan-republicans-repeal-prevailing-wage-law
2018-06-07,Michigan Gubernatorial Race,"[Dem: El-Sayed] El-Sayed has revealed his universal health care proposal. It involved raising taxes on large businesses and individuals to pay for a universal ""Michicare"" - estimated to save $5000 a year in health care related savings for the average Michigan family.",https://www.detroitnews.com/story/news/local/michigan/2018/06/06/el-sayed-universal-health-michigan/677394002/
2018-06-07,Michigan Gubernatorial Race,"[Rep: Colbeck] Detailed article about Colbeck, considered the most conservative candidate. It covers his history, stances on major issues and his distancing from the GOP following islamophobic comments made towards El-Sayed. ",https://www.detroitnews.com/story/news/local/michigan/2018/06/06/patrick-colbeck-governor-republican-primary/613371002/
2018-06-07,Progress Michigan ,A bill reported out of a Senate committee Tuesday would exempt Michigan utilities from personal property taxes on their transmission lines and pipelines - claim it will protect Michigan electricity customers from higher rates. Opponents fear it could cost local governments $576.3 million annually within 10 years. ,https://www.freep.com/story/news/local/michigan/2018/06/05/michigan-senate-panel-tax-break-utilities/674681002/
2018-06-08,LCV,"Chemicals used to water-proof clothing, shoes, carpeting, non-stick cookware and fire fighting foam have been found to be contaminating 23 sites near Clinton River and Lake St. Clair in St. Clair and Macomb counties Michigan. ""We call them legacy pollution,"" said Bob Allison, deputy director of the Michigan League of Conservation Voters. ""Forever chemicals. These things don't go away.""",thetimesherald.com
2018-06-08,Progress Michigan,"Schuette is saying that ""Michigan […] is last in the nation in third-grade reading"" - based on a misinterpretation of one line in the introduction to one report, with no data to back it up. The average fourth-grader in Michigan is reading at a grade level 1.5 grades lower than the average Massachusetts fourth-grader, according to the National Assessment of Educational Progress, as one example. And Michigan ranks in the bottom third of states nationally in most subjects and grades tested by NAEP.",michiganradio.org
2018-06-08,Progress Michigan,"Michigan AG Schuette debuts new OK2SAY initiative, a 4-year old program that will unveil a new feature - student ambassadors. The program aims to bring kindness, inclusion, and awareness activities and ideas into schools.",upnorthlive.com
2018-06-08,Progress Michigan,"Democratic members of the House Committee on Education and the Workforce are calling on Education Secretary Betsy DeVos to explain how the school safety commission that she chairs will study gun violence as part of its work. The commission, which was set up after the deadly shooting in Parkland, Florida, would not focus on how guns contribute to school violence.",cnn.com
2018-06-08,Progress Michigan,"The Republican-led Michigan Legislature on Thursday gave final approval to a bill requiring able-bodied adults in the state's Medicaid expansion program to meet work or job-related requirements, sending it to Gov. Rick Snyder for his expected signature. By 2020, adults age 18 to 62 would have to show workforce engagement averaging 80 hours a month — through work, school, job or vocational training, an internship, substance abuse treatment or community service. ",abcnews.go.com
2018-06-08,Planned Parenthood,"At a press conference held Thursday outside the Capitol Building, the members of Congress, along with pro-life group Live Action, asked the Department of Health and Human Services to investigate Planned Parenthood and other Title X fund recipients to determine if there is a widespread practice of covering up sexual abuse.",catholicregister.org
2018-06-11,Michigan Gubernatorial Race ,"[Dem: Whitmer] Whitmer released a new 11-page education policy platform calling for more state spending to phase in universal preschool, give districts extra money to hire additional literacy coaches, hire more counselors and potentially increase educator pay.",https://www.detroitnews.com/story/news/local/michigan/2018/06/08/whitmer-give-michigan-teachers-raise/685938002/
2018-06-11,LCV ,DTE announces plans to open another plan that would emit pollution in East China Township. Residents have different views about the new facility (to be completed by 2022) - it was okayed by the Michigan Public Service Commission despite opposition from a number of environmental groups. ,https://www.detroitnews.com/story/news/local/michigan/2018/06/11/dte-natural-gas-plant-michigan-dissent-support/652401002/
2018-06-11,Michigan Gubernatorial Race ,"[Rep: Schuette] Schuette writes article highlighting the need for ethics reform in Michigan - calling for stricter ethics laws and stating, as governor, he would make reforms happen. ",http://www.hollandsentinel.com/news/20180515/bill-schuette-michigan-needs-strong-ethics-reforms
2018-06-11,Progress Michigan ,Michigan Progressive Summit is happening on June 16th in Flint - an event for progressive activists in Michigan to network and skill-build. ,http://themichigansummit.org/
2018-06-11,Progress Michigan ,"One Fair Wage, a proposal to incrementally raise the minimum wage to $12 by 2022, could appear on the general election ballot in November. The law would highly impact the restaurant industry. Currently, tip credit allows employers to pay tipped employees as little as $3.52 an hour. Tipping culture also adversely impacts women and POC. Opposition (including the Michigan Restaurant Association) claim it would increase restaurant owners’ labor costs by 241% and could mean huge job loss. ",https://www.freep.com/story/entertainment/dining/mark-kurlyandchik/2018/06/08/restaurant-tips-michigan-ballot-one-fair-wage-roc/682109002/
2018-06-11,LCV ,Residents in Grand Rapids are calling for an investigation into soil quality after generations of high cancer rates. The local Butterworth landfill has a history of soil contamination and has been previously investigated by the EPA. ,http://www.mlive.com/news/grand-rapids/index.ssf/2018/06/after_3_generations_of_cancer.html#incart_river_index
2018-06-12,LCV ,Environmentalists planning to speak out today about the dangers of Line 5 prior to Enbridge releasing an alternatives report this week. Enbridge is expected to support the utility tunnel method. ,http://www.9and10news.com/2018/06/12/environmentalists-to-speak-out-about-replacement-plans-of-enbridge-line-5/
2018-06-12,Michigan Gubernatorial Race,"[Dem: Whitmer] Build a Better Michigan, a group aligned with  Whitmer, launched today a five-week, $1.8 million advertising campaign putting her in television ads for the first time this cycle. These are ""issue ads"" featuring Whitmer but not directly advocating for her election. ",https://www.detroitnews.com/story/news/local/michigan/2018/06/12/whitmer-featured-1-8-m-tv-ad-campaign/693550002/
2018-06-13,Michigan Gubernatorial Race,"[Dem: El-Sayed] El-Sayed announces plan to reduce auto insurance rates by prohibiting insurers from using non-driving factors to determine rates, creating a “Truth in Insurance Commission” to oversee the industry, capping hospital charges and restricting attorney access to accident reports.
",https://www.detroitnews.com/story/news/local/michigan/2018/06/13/el-sayed-auto-insurance-reforms/697353002/
2018-06-13,LCV,"Enbridge to release alternatives report this Friday, expected to support a utility tunnel. Environmentalists still oppose this approach. ",http://michiganradio.org/post/ahead-enbridge-report-experts-say-tunnels-are-not-solution
2018-06-13,Michigan Gubernatorial Race,"[Rep: Calley] In depth interview with Calley. Topics include: education as his top priority, increasing school security to combat school shootings, creating more jobs will allow more people to have health insurance coverage and how Michigan can deal with water contamination. ",http://michiganradio.org/post/checking-2018-gubernatorial-candidates-brian-calley
2018-06-13,LCV,"A bill that would create ""citizen panels"" of people with special interest and expertise in different areas and allow them to oversea decisions made by the MDEQ has been approved by Senate. Opponents argue the panels would be made of industry officials who want to have a say  in environmental policy and regulation - a clear conflict of interest. ",https://www.freep.com/story/news/2018/06/12/controversial-environmental-review-bills-headed-gov-snyder/696642002/
2018-06-13,Progress Michigan ,"Changes to the state budget detail how Michigan's lowest performing schools will face consequences if they don't meet specific measurable academic outcomes within a specified time frame. Consequences include the closure of schools or schools being ""reconstituted"" if academic improvement goals aren't met. ",http://www.mlive.com/news/index.ssf/2018/06/state_budget_clarifies_consequ.html#incart_river_index
2018-06-14,Michigan Gubernatorial Race,"[Dem: Whitmer] Americans for Prosperity, a conservative group funded by the Koch brothers, has launched a $1.7M television ad campaign attaching Whitmer and linking her to Granholm. ",https://www.detroitnews.com/story/news/local/michigan/2018/06/13/americans-prosperity-attacks-gretchen-whitmer-tv-ad-campaign/698673002/
2018-06-14,Michigan Gubernatorial Race,"[Rep: Hines] Hines is embracing his position as a outsider in the republican race. This article gives an in depth look at his background, career and reasons behind running for office. ",https://www.detroitnews.com/story/news/local/michigan/2018/06/14/governor-michigan-jim-hines-republican/623272002/
2018-06-14,LCV,"Michigan residents are still concerned over PFA levels in the water. Studies have shown that PFAs toxins pose a threat to drinking water when they accumulate in groundwater and can have adverse health affects. Reports have speculated that the EPA is sitting on a study about the harmful effects of PFAs contaminants because the White House deems it a “public relations nightmare."" ",http://michiganradio.org/post/epa-sitting-study-about-harmful-effects-pfas-contaminants
2018-06-14,Planned Parenthood,"A federal judge ruled in favor of two Michigan Christian colleges on Tuesday, allowing them to avoid paying for abortion-related healthcare under an Obama-era mandate. The mandate required health insurance providers, including universities, to supply access to family planning resources including abortions and birth control. ",https://www.freep.com/story/news/local/michigan/2018/06/13/cornerstone-university-abortion-pill-lawsuit/698548002/
2018-06-14,LCV,Michigan will finalize the country's toughest lead drinking water rules today. The new rules from the DEQ would lower lead action levels to 12 parts per billion starting in 2025 and require communities across the state to remove all lead service lines. The rule change was initiated in the wake of the Flint water crisis. ,https://www.detroitnews.com/story/news/local/michigan/2018/06/14/michigan-strictest-lead-water-rules-america/699135002/
2018-06-14,Progress Michigan ,"Figures released Wednesday show Michigan's unemployment rate was at it's lowest level since last August. Total employment increased by 10,000 during the month of May and the number of unemployed in Michigan fell by 5,000. ",https://www.detroitnews.com/story/news/local/michigan/2018/06/13/unemployment-rate-michigan/36005427/
2018-06-14,Michigan Gubernatorial Race,"[Rep: Schuette] This Friday Mike Pence is attending a fundraiser for Schuette in Michigan. The ""Make Michigan Win Again"" event is starting at noon in Birmingham. ",https://www.wxyz.com/news/vp-mike-pence-coming-to-michigan-to-support-schuette-for-governor
2018-06-14,Planned Parenthood,Michigan’s Republican-led Legislature on Tuesday approved a $56.8 billion budget for next year that seeks to cut aid for Planned Parenthood despite a warning from Snyder the ban may be unconstitutional. The language around PP prohibits the Michigan Department of Health and Human Services from contracting for non-abortion family planning and reproductive services with an entity that also performs abortions. Senate Democrats who still voted for spending bill are confident the governor will declare the Planned Parenthood provision unenforceable,https://www.detroitnews.com/story/news/local/michigan/2018/06/12/michigan-bans-aid-planned-parenthood/694208002/
2018-06-15,Michigan Gubernatorial Race,"[Rep: Schuette] Bridge Truth Squad examines Schuette's claims that he opposed Obama era environmental protections. Schuette was involved in two lawsuits — one of which he spearheaded — in which he supported the position of coal-fired power plants, whose emissions, studies say, can cause asthma and other health effects.",https://www.bridgemi.com/michigan-truth-squad/michigan-truth-squad-bill-schuettes-record-pollution-under-fire
