Date,Category ,Summary,Link 
2018-05-16,Planned Parenthood,Trump is considering a “domestic gag rule” which would essentially apply the same restrictions as the global rule (where NGOs cannot actively promote abortion as a method of family planning). Would force PP to either stop discussing abortion with their patients or stop receiving Title X funds (federal grant for family planning services). ,http://nymag.com/daily/intelligencer/2018/05/trumps-proposed-domestic-gag-rule-hits-planned-parenthood.html
2018-05-16,LCV,Renewable energy developers are worried about a ballot campaign aiming to double Michigan’s renewable portfolio standard to 30% by 2020. Concerned it will make renewable energy a political issue again. ,https://energynews.us/2018/05/14/midwest/renewable-developers-fear-michigan-campaign-will-create-political-wedge/
2018-05-16,Michigan General ,Michigan’s small business climate is losing momentum having dipped in its “entrepreneurial climate” score since 2016. ,https://mibiz.com/item/25798-entrepreneurial-report-shows-michigan%E2%80%99s-progress-slowing
2018-05-16,Michigan General ,Voter turnout for the May vote (focused mostly on school millage and bond requests) was so small it’s sparking interest in consolidating Michigan’s election calendar (i.e. eliminating May elections). ,http://michiganradio.org/post/genesee-county-clerk-says-michigan-should-drop-may-vote
2018-05-16,Michigan General ,Political parties are showing increased interest in the upcoming Michigan State University board election (the first since the Nassar trails). Voters this fall will be replacing two Republican trustees (currently the board is split evenly between Dems and Repubs.),https://lansingstatejournal.com/story/news/local/2018/05/14/larry-nassar-scandal-michigan-state-board/594079002/
2018-05-16,Michigan Gubernatorial Race,Much better link to watch the debate from last week. ,https://bridgemi.com/public-sector/watch-dem-gop-michigan-governor-candidates-share-stage-first-time
2018-05-16,Michigan Gubernatorial Race,State staffers in Schuette’s office were involved in at least four private real estate transactions in the Virgin Islands. Schuette has been accused of violating his pledge to put assets into a blind trust. Schuette argues the property was never part of the blind trust as it does not represent a conflict. ,https://detroitnews.com/story/news/politics/2018/05/11/staffers-sign-schuette-real-estate/34798771/
2018-05-17,Planned Parenthood,Appeals court refuses to dismiss a lawsuit by PP over Centre for Medical Progress videos allegedly showing the illegal sale of fetal tissue. PP says the center deceptively edited and created false videos that were posted online.,http://ottawacitizen.com/pmn/news-pmn/appeals-court-refuses-to-toss-planned-parenthood-video-suit/wcm/0860b6a5-0b0a-43f0-a2d9-f45276d62555
2018-05-17,LCV,Michigan House votes to loosen mining permit laws. Mining companies would be able to modify onsite facilities without an environmental permit amendment under the new legislation.,http://michiganradio.org/post/michigan-house-votes-loosen-mining-permit-laws
2018-05-17,LCV,Attorneys for Michigan Department of Health and Human Services Director say notes from a September 2015 conference call prove their client put the office of Gov. Rick Snyder on notice about outbreaks of Legionnaires' disease in Flint months before the governor told the public.,http://mlive.com/news/flint/index.ssf/2018/05/lyon_says_notes_prove_he_warne.html#incart_2box_mlive_homepage_featured_entries
2018-05-17,Michigan General,"Michigan income tax and sales tax are higher than expected and should give lawmakers approximately $500 million in budget surplus. The money will be used to boost spending on infrastructure, school safety initiatives and pay down debts. The elevated projections are said to reflect a stronger economy and “disciplined state budgets”.",https://detroitnews.com/story/news/local/michigan/2018/05/16/michigan-surplus-road-school-funding/34985935/
2018-05-17,Michigan General,Michigan State U settles Nassar Lawsuit for $500 million.,http://mlive.com/news/index.ssf/2018/05/do_not_publish_settlement_reac.html#incart_most-read_
2018-05-17,Michigan Gubernatorial Race,"Dem: El-Sayed
Good article covering El-Sayed. Details his history with Duggan, Mayor of Detroit - El-Sayed had expected to get an endorsement from Duggan, but he instead endorsed Whitmer.",https://freep.com/story/news/2018/05/17/abdul-el-sayed-michigan-governor/613226002/
2018-05-22,Planned Parenthood,"Civil Rights Commission said Monday that gay and transgender residents should be protected under current state law. The commission held that existing protections against sex discrimination should also hold for sexual orientation and gender identity. Critics claim the panel exceeded its authority, consider legal action.",https://www.detroitnews.com/story/news/local/michigan/2018/05/21/gay-trans-michigan-discrimination-protections/630204002/
2018-05-22,Planned Parenthood,Schuette signs amiscus brief (advises courts of relevant info or arguments to consider) in case of Ohio Planned Parenthood vs. Ohio Department of Health regarding an attempt to cut federal funding for Ohio Planned Parenthood clinics.,http://greatlakesbeacon.org/2018/05/15/schuette-signs-on-to-battle-planned-parenthood-again/
2018-05-22,LCV,"Michigan is approaching completion on new water regulations for lead. It is the strictest plan to date and would result in the replacement of all lead service pipes in Michigan. Local government and water utilities oppose the regulations, claiming they are an overreaction in response to Flint, and will be costly and largely ineffective.",http://www.thestate.com/news/business/national-business/article211454719.html
2018-05-22,LCV,"Detroit Renewable Power, a solid waste incinerator, has a history of exceeding pollution emissions standard. The Department of Environmental Quality, in negotiations with Michigan Attorney General’s Office, has cited the company for only 8 pollution incidents, though records show they’ve exceeded emissions standards hundreds of times. Environmental groups want the incinerator to face more penalties, some calling for it to be shut down.",https://www.freep.com/story/news/local/michigan/detroit/2018/05/21/detroit-renewable-power-incinerator-pollution-deq/623615002/
2018-05-22,Progress Michigan,An article reviewing the Republican candidate’s stances on transparency as well as their financial disclosures to Bridge. Provides a more in-depth review of Schuette’s real estate assets.,https://www.bridgemi.com/public-sector/three-four-republicans-share-tax-returns-bill-schuette-said-he-will-soon
2018-05-22,Progress Michigan,"A minimum wage ballot initiative backed by Michigan One Fair Wage has been submitted Monday with over 370,000 signatures. The proposal would raise Michigan’s minimum wage to $12 by 2022. The ballot is opposed by state business groups.",https://www.detroitnews.com/story/news/local/michigan/2018/05/21/signatures-michigan-minimum-wage-ballot-initiative/629749002/
2018-05-22,Progress Michigan,An extensive review of the ways in which Michigan’s education system is failing students. Points to low rates of educational attainment and how this impacts economic growth.,http://www.mlive.com/news/index.ssf/2018/05/michigan_beyond_education.html
2018-05-22,Michigan Gubernatorial Race,"Rep: Schuette   Schuette was at the White House May 18th participating in a discussion on the future of criminal justice reform. He highlighted a need to reduce barriers to prisoners reentering society, including reducing licensure requirements for skilled trades and literacy education in prisons.","https://www.michigan.gov/ag/0,4534,7-359-82916_81983_47203-468989--,00.html"
2018-05-22,Michigan Gubernatorial Race,Rep: Schuette + Calley Calley is now calling for an independent investigation of Schuette alleging that the real estate dealing he did while in office (notarized by office staff) broke the law.,https://www.detroitnews.com/story/news/politics/2018/05/17/calley-investigation-schuette-state-staff/35024453/
2018-05-22,Michigan Gubernatorial Race,Dem: Thanedar     Interview detailing attacks Thanedar made on other democratic opponents. Calling El-Sayed “just a rich kid” and claiming Whitmer “hasn’t had anything to show as her accomplishments.”,https://theintercept.com/2018/05/22/shri-thanedar-michigan-governor-race-shri-thanedar-abdul-el-sayed/
2018-05-22,Michigan Gubernatorial Race,"Good, quick overview of all the candidates.",https://www.detroitnews.com/story/news/politics/2018/05/21/michigan-governor-candidates/35169065/
2018-05-22,Michigan Gubernatorial Race,"Libertarians are included in the upcoming primary (the first time since 1998 that a third party has qualified to hold a primary in Michigan). The contested primary means Libertarian issues will be brought to the political conversation and has the potential to sway “Michigan’s famously independent, swing voters.”",http://michiganradio.org/post/libertarian-primary-first-time-michigan-history
2018-05-23,Planned Parenthood,"More information on Title X funding and how Trumps announcement will impact Planned Parenthood. Title X specifically serves those who don’t have Medicaid, meaning cutting this funding will directly impact a vulnerable population.",https://www.cnn.com/2018/05/22/health/title-x-planned-parenthood-defunding-reax-bn/index.html
2018-05-23,LCV,Michigan House has approved a bill that gives industry representatives a larger role in environmental regulation. The legislation creates private-sector panels (populated mostly by industry representatives) that could override agency decisions on rules and permits.,https://www.bridgemi.com/michigan-environment-watch/michigan-house-approves-bills-letting-industry-vote-environmental-rules
2018-05-23,LCV,About 100 protesters gathered at Snyder’s office yesterday to demand the state continue to provide bottles water to Flint residents. Water distribution was ended last month.,https://www.usnews.com/news/best-states/michigan/articles/2018-05-22/protesters-bottled-water-should-still-be-provided-in-flint
2018-05-23,Progress Michigan,"While educational outcomes have improved across the nation, Michigan continues to fall behind on test scores, on-time graduations and secondary school numbers. Many see the K-12 system as severely hurt by bad policies around school choice, many leading back to Betsy DeVoss (a supporter of Schuette). This article explores various aspects of the debate via a number of experts and education advocates.",http://www.mlive.com/news/index.ssf/2018/05/michigan_schools_on_a_race_to.html
2018-05-23,Michigan Gubernatorial Race,Rep: Schuette.  Schuette signs Americans for Tax Reform pledge to never raise taxes because he “will be Michigan's jobs and paychecks governor”.,https://twitter.com/SchuetteOnDuty/status/998962075480350720/photo/1
2018-05-23,Michigan Gubernatorial Race,Dem: Thanedar   Thanedar has hired David Bullock to manage his statewide campaign. Bullock is a prominent Detroit activist and pastor and is well known in the community. Shows Thanedar making an active push for support in Detroit.,https://www.detroitnews.com/story/news/local/michigan/2018/05/22/thanedar-campaign-manager-detroit-bullock/632750002/
2018-05-23,Michigan Gubernatorial Race,Democrats.    El-Sayed and Whitmer have released details about their finances to Bridge Magazine. Thanedar has refused to disclose his finances despite multiple statements voicing support for transparency from state elected leaders. Article details what each candidate has disclosed in response to Bridge’s request.,https://www.bridgemi.com/public-sector/michigan-democrats-el-sayed-whitmer-disclose-taxes-shri-thanedar-does-not
2018-05-25,Planned Parenthood,"Planned Parenthood considering litigation against Trump if he moves forward with proposed cut to Title X funding. The National Family Planning and Reproductive Health Association, a membership organization of Title X family planning clinics, also said it would consider litigation. ",http://thehill.com/policy/healthcare/389227-planned-parenthood-considers-litigation-on-trumps-proposed-changes-to
2018-05-25,LCV,"Snyder has approved an emergency order yesterday prohibiting ships from dropping anchors in the Straits of Mackinac following an April act that ruptured transmission cables and dented Line 5. The rule prohibits boats from deploying, dragging, setting or otherwise using an anchor in a defined area of the straits, except in cases of emergency.",https://www.detroitnews.com/story/news/local/michigan/2018/05/24/snyder-no-anchor-straits-mackinac/640956002/
2018-05-25,LCV,"New poll found 54% of Michigan voters want the Line 5 oil pipeline in the Straits of Mackinac to be shut down, 87% of voters said they are concerned that the 65-year-old pipeline could have oil spill in Northern Michigan.",http://michiganradio.org/post/new-poll-says-most-michigan-voters-want-line-5-shut-down
2018-05-25,LCV,Pair of legal challenges filed Monday State regulators failed to enforce environmental laws when they allowed additional structural supports for Line 5 without proper review. Claim Michigan DEQ didn't appropriately evaluate alternatives and the potential for damaging environmental effects when they granted permits earlier this year for Enbridge to install new screw anchors.,http://www.mlive.com/news/grand-rapids/index.ssf/2018/05/lawyers_claim_deq_failed_to_en.html
2018-05-25,Progress Michigan,Michigan has seen higher interest in guns over the past few months - stats show there has been an increase in sales and concealed pistol licenses issued since the Parkland shooting.,https://www.detroitnews.com/story/news/local/michigan/2018/05/23/gun-sales-concealed-pistol-licenses-michigan/35288961/
2018-05-25,Progress Michigan,"While Michigan provides free, state-funded preschool for 4-year-olds from low-to-moderate-income families, it offers little financial help for families with children ages three and younger. Michigan’s childcare assistance for children under 4 has some of the most restrictive income eligibility requirements in the nation. ",http://www.mlive.com/news/index.ssf/2018/05/early_childhood.html
2018-05-25,Michigan Gubernatorial Race,"Rep: Schuette
Calley’s recent ad attacks Schuette’s flip-flopping on various issues including abortion. Bridge looks into the truth behind the claim and finds that Schuette’s rhetoric around abortion has shifted. In his early political campaigns in the 80s, his stance was-  personally opposed to abortion but in favor of abortion rights. 
",https://www.bridgemi.com/michigan-truth-squad/michigan-truth-squad-brian-calley-says-bill-schuette-once-supported-abortion
2018-05-25,Michigan Gubernatorial Race,"Rep: Schuette 
Schuette discloses his personal finances that show assets totaling more than $13M. 
",https://www.usnews.com/news/best-states/michigan/articles/2018-05-24/schuette-financial-disclosure-shows-assets-total-13m
2018-05-25,Michigan Gubernatorial Race,"Rep: Schuette
Video of Schuette speaking on fixing Michigan roads: need to have warranties on roads, some form of guarantee’s, a “clean fresh scrub” of the transportation policy. 
",https://www.freep.com/videos/news/politics/2018/05/24/bill-schuette-fixing-michigan-roads/35321279/
2018-05-25,Michigan Gubernatorial Race,"Rep: Schuette
In depth article outlining Schuette’s political history, looks into inconsistencies in his stances (which have shifted more to the right in recent years). 
",https://www.freep.com/story/news/local/michigan/2018/05/25/bill-schuette-michigan-governor-candidate/584678002/
2018-05-25,Michigan Gubernatorial Race,"Dem: Thanedar
Video surfaces of Thanedar at a Republican rally for Mark Rubio in 2016. Video shows him clapping and seeking out a photo with the U.S. senator from Florida. Two Michigan political consultants have claimed that Thanedar has initially not been sure if he would run as a Democrat or Republican, questioning his stance as the “most progressive” candidate. ",https://www.detroitnews.com/story/news/local/michigan/2018/05/24/thanedar-rubio-rally-no-crime/642027002/
2018-05-25,Michigan Gubernatorial Race,"Dem: Whitmer
Whitmer facing challenge of being widely unknown by those outside of Democratic circles.  A recent poll showed 54% of 600 people surveyed didn't recognize her name among the Democratic candidates, compared with 31% for Thanedar and 47% for El-Sayed.",https://www.freep.com/story/news/local/michigan/2018/05/24/gretchen-whitmer-governor-michigan/629845002/
2018-05-25,Michigan Gubernatorial Race,"Dem: Whitmer
Gretchen Whitmer has released a plan called the “Michigan Sunshine Plan”, outlining how she would reform Michigan state government by making it more open, transparent and accountable to taxpayers. Schuette has announced a similar plan. 
",http://www.dailytribune.com/government-and-politics/20180524/gretchen-whitmer-announces-plan-to-make-state-government-more-transparent
2018-05-25,Michigan Gubernatorial Race,"Twitter says it’s adding special labels to tweets from some U.S. political candidates, including candidates for governor, ahead of this year’s midterm elections. The labels will include what office a person is running for and where. ",https://www.detroitnews.com/story/tech/2018/05/23/twitter-election-labels/35260107/
2018-05-25,Michigan Gubernatorial Race,"Redistricting group, trying to change the way Michigan draws political boundaries, rallied Thursday at the Capitol and urged state officials to put the proposal on the November ballot despite a legal challenge.",https://www.detroitnews.com/story/news/local/michigan/2018/05/24/voters-not-politicians-ballot-fight/642378002/
2018-05-28,Planned Parenthood,"*Not Michigan specific - Ireland has voted to legalize abortion up to 12 weeks, a landmark decision with global implications. ",https://www.ctvnews.ca/world/irish-voters-overwhelmingly-repeal-abortion-ban-1.3946437
2018-05-28,Progress Michigan ,"Michigan House Republicans are warming up to the idea of approving and later amending a marijuana legalization initiative. However, it is still not likely that the 55 votes required for House passage will be secured by the June 5 deadline. ",https://www.detroitnews.com/story/news/local/michigan/2018/05/28/michigan-republicans-pot-legalization-deadline/645315002/
2018-05-28,LCV,"Flint officials say there are more damaged lead and galvanized water service lines buried than previously estimated with an estimated 14,000 lines remaining buried. Efforts to replace the lines will continue throughout the year. ",https://www.detroitnews.com/story/news/michigan/flint-water-crisis/2018/05/27/flint-water-crisis-lead-pipes/35421281/
2018-05-28,LCV,"Article detailing the positive economic impacts of fishing and hunting in Michigan (support more than 70,000 jobs and generate about $5 billion annually). These activities also contribute huge amounts of funding to restoration and conservation efforts on public lands. ",https://www.freep.com/story/sponsor-story/michigan-wildlife-council/2018/05/28/angling-better-michigan-economy/641646002/
2018-05-28,Michigan Gubernatorial Race,"This week is the Mackinac Policy Conference this week. Focus will be on the following themes: Michigan's preparedness and competitiveness for business investment, readiness for next-generation mobility and trust in government, media and business institutions. **During the conferance there will be a gubernatorial debate.",http://www.mlive.com/news/index.ssf/2018/05/what_to_expect_at_the_2018_mac.html
2018-05-28,Michigan Gubernatorial Race,"Dates for upcoming debates.
May 31st: Top three candidates from both parties debate (live streamed on the Detroit Regional Chamber's website)
June 20th: Democratic candidates debate (WOOD-TV)
June 28th: Republican candidates debate (WDIV-TV)
July 19th: Democratic candidates debate (WDIV-TV)
","https://www.freep.com/story/news/politics/2018/05/24/michigan-governor-debates/638777002/
"
2018-05-29,LCV ,"Line 5 is not on the agenda for the Mackinac Policy Conference starting today, angering environmental advocates. The Great Lakes Business Network (a group concerned over line 5) is planning a news conference tomorrow morning to release a new study ",https://www.freep.com/story/news/local/michigan/2018/05/29/enbridge-line-5-pipeline-straits-mackinac/644043002/
2018-05-29,LCV ,Members of Oil and Water Don't Mix are planning a protest for today as people arrive for the Mackinac Policy Conference. ,https://www.publicnewsservice.org/2018-05-29/environment/protests-set-at-mackinac-policy-conference/a62697-1
2018-05-29,Michigan Gubernatorial Race,"Rep: Schuette 
Article written by Schuette detailing how he will cut taxes. Specifically attacks Calley, contrasting their tax approaches and details plans to bring up the issue of taxes at the debate this week.  ",http://www.hollandsentinel.com/news/20180528/bill-schuette-clear-choice-on-tax-cuts
2018-05-29,Progress Michigan ,Memorial day weekend involved multiple shootings in Detroit with a total of 8 fatalities. May reignite debate over gun issues. ,https://www.detroitnews.com/story/news/local/detroit-city/2018/05/29/greektown-shooting-detroit-memorial-day/650447002/
2018-05-29,Progress Michigan ,"Infrastructure and road repairs is a recurring issue throughout Michigan. Recent survey shows 89% of respondents think Michigan's road and bridge quality is ""fair or poor"", but over 60% would not be willing to pay more in taxes or fees to support state transportation improvements. ",https://www.freep.com/story/news/local/michigan/2018/05/29/michigan-roads/650621002/
2018-05-29,Michigan Gubernatorial Race,"Michigan Campaign Finance Network reports that of the 30 largest legislative leadership political action committees, 24 of them are Republican. Collectively these 30 PACs have raise $3.4 million, with Republicans out fundraising Democrats by a 6 to 1 margin. ",http://michiganradio.org/post/campaign-cash-flowing-republican-leadership-pacs
2018-05-30,LCV,"Recent study states Line 5 puts Michigan at risk for an environmental disaster but has evolved into what is mostly a shortcut for a Canadian company to move Canadian oil to Canadian refineries. i.e. Canada receives the economic benefits of the line, while Michigan receives very few. ",https://www.freep.com/story/news/local/michigan/2018/05/30/enbridge-canada-line-5-michigan-risk/652405002/
2018-05-30,Michigan Gubernatorial Race,"Dem: Whitmer and Thanedar 
Whitmer and Thanedar roll out economic plans. Thanedar wants to eliminate income taxes for low-income residents but raise taxes $3.6 billion on corporations and wealthy individuals. Whitmer calls for $100 million a year in new spending to create new college scholarships and skills training programs.",https://www.detroitnews.com/story/news/local/michigan/2018/05/29/whitmer-thanedar-mackinac-economic-plans/652792002/
2018-05-30,Michigan Gubernatorial Race,"Rep: Schuette
Schuette talked to voters about various issues at his annual barbecue in Presque Isle yesterday. Topics included high auto insurance rates and quality of Michigan education and spending. Schuette stressed his plan to cut taxes. ",http://www.uppermichiganssource.com/content/news/Bill-Schuette-continues-UP-tour-with-annual-BBQ-484005931.html
2018-05-30,Planned Parenthood,The Supreme Court Decision yesterday rejected Planned Parenthood's challenge to an Arkansaw abortion law that made accessing medication abortions extremely difficult. Planned Parenthood will continue their fight against the law. ,https://www.theguardian.com/us-news/2018/may/29/supreme-court-arkansas-abortion-pill-rejected-planned-parenthood
2018-05-30,LCV,A settlement for Flint children over the water crisis is expected to be resolved this summer. So far a judge has a approved a partial settlement giving universal screenings for learning disabilities for all Flint children affected by lead-contaminated water and creating a neurodevelopmental center for deeper assessments. ,https://www.detroitnews.com/story/news/michigan/flint-water-crisis/2018/05/29/settlement-possible-flint-kids-over-water-impact/652697002/
2018-05-31,Michigan Gubernatorial Race,"Dem: El-Sayed
Interviewed at the Mackinac Policy Conference , thinks this conference is what its wrong with politics - ""folks in power get together and talk about how to keep power."" Also touches on his universal healthcare plan.",https://www.clickondetroit.com/michigan-elections/abdul-el-sayed-says-mackinac-policy-conference-exactly-what-is-wrong-with-politics
2018-05-31,Michigan Gubernatorial Race,"Dem: Whitmer
Americans For Prosperity, a conservative advocacy group backed by the Koch brothers, is running an online ad targeting Whitmer, claiming she has supported tax increases that led to the loss of hundreds of thousands of jobs in Michigan. The Bridge Truth Squad calls the ad ""half-accurate"" - Whitmer has supported tax increases but the ad is misleading in its insineuation that tax increases cause Michigan's mass job loss. ",https://www.bridgemi.com/michigan-truth-squad/truth-squad-koch-brothers-group-attacks-gretchen-whitmers-tax-votes
2018-05-31,Michigan Gubernatorial Race,"Dem: Thanedar
Thanedar has released his 2015 and 2016 tax returns and other financial details. He has assets of approximately $30 million, most likely making him the wealthiest candidate in the race. 
",https://www.bridgemi.com/public-sector/democrat-shri-thanedar-releases-tax-returns-michigan-governor-race
2018-05-31,Progress Michigan ,"More than 100 low-income voters from Detroit and Flint plan to stage a ""die-in"" protest at Schuette's office today at 12:30. They are protesting Schuette's opposition to thet state's Medicaide expansion",https://michronicleonline.com/2018/05/31/medicaid-recipients-from-detroit-flint-blast-schuettes-plan-to-cut-healthcare/
