Date,Category ,Summary,Link 
2018-06-15,Progress Michigan ,"A group of conservative advocates, including Colbeck, have proposed a new social studies curriculum standard for K-12. The new guide removes climate change as a mandatory teachable and sections where teachers are urged to discuss the accomplishments and setbacks of minority groups. Democrats are calling the new standards ""revisionist history."" ",http://www.mlive.com/news/index.ssf/2018/06/lawmakers_call_proposed_social.html#incart_river_index
2018-06-15,Michigan Gubernatorial Race,"Mlive, a prominent Michigan news source, has partnered with League of Women Voters of Michigan to provide candidate information and other voting resources to our Michigan readers. The group is a nonpartisan, political organization that encourages informed and active participation in government. ",http://www.mlive.com/news/index.ssf/2018/06/mlive_partners_with_league_of.html#incart_river_index
2018-06-15,Progress Michigan ,"A number of Michigan communities have filed lawsuits against  opioid manufacturers, arguing that they aggressively promoted their products by falsely claiming the drugs aren't addictive. The 1995 Michigan Product Liability Act grants pharmaceutical companies nearly absolute immunity from lawsuits filed by consumers and was co-sponsored by Schuette who was a state senator at the time. ",https://www.detroitnews.com/story/news/local/michigan/2018/06/15/michigan-law-shields-opioid-lawsuits/649577002/
2018-06-15,Michigan Gubernatorial Race,[Dem: Whitmer] Short interview and overview of Whitmer and her platform. ,https://fox17online.com/2018/06/14/get-to-know-the-candidates-gretchen-whitmer/
2018-06-15,Michigan Gubernatorial Race,"[Dem: El-Sayed] Crain's Detroit Business column about Abdul El-Sayed sparked clashes on social media over whether he inflates his professional status. His doctor credentials are a focal point of his campaign, but he's never actually practiced as a post-medical school doctor. ",http://www.deadlinedetroit.com/articles/20001/update_candidate_abdul_el-sayed_s_use_of_doctor_stirs_feisty_fray#.WyPBDBMrJZ0
2018-06-15,LCV,"Bridge Truth Squad tackles claims made on the League of Conservation Voters site attacking Schuette's stance on Line 5. The article calls the claims ""mostly accurate"" as Schuette could argue in court for a Line 5 shutdown but hasn’t. However, they point out the site could have extra context that a shutdown would require a court order, and that Schuette has still been involved in negotiations concerning Line 5’s safety. ",https://www.bridgemi.com/michigan-truth-squad/michigan-truth-squad-bill-schuette-talks-tough-line-5-pipeline
2018-06-18,Michigan Gubernatorial Race,"[Rep: Schuette] Pence visited Michigan Friday in support of Schuette. Small protests awaited them at both stops, representatives from both Progress Michigan and Planned Parenthood were present at the protests. ",https://www.freep.com/story/news/local/michigan/2018/06/15/pence-michigan-schuette-tax-plan-rewold-son/706672002/
2018-06-18,LCV ,"Michigan has been highly impacted by global warming, particularly the Lower Peninsula, which since 1988 has experienced a 2.16-degree Fahrenheit temperature increase. The higher temperatures have impacted the tourism industry, forcing a shorter winter ski season. ",https://www.detroitnews.com/story/news/local/michigan/2018/06/18/global-warming-michigan-temperature-increase-16th-highest-among-lower-48-states/705633002/
2018-06-18,LCV ,"The report from Enbridge delivered to Snyder on Friday claims a new tunnel underneath the straits is a viable option to replace line 5 after undergoing a feasibility study. The tunnel is the costliest option, requiring up to $500 million and up to six years to complete, but was also deemed the least environmentally risky. LCV criticized the company's failure to consider a replacement option outside of the straits. ",http://www.mlive.com/news/grand-rapids/index.ssf/2018/06/enbridge_says_line_5_tunnel_vi.html#incart_river_index
2018-06-18,Michigan Gubernatorial Race,"Michigan Democrats have introduced a bill that would change the voting age to 16, inspired by the outpouring of young activism following the Parkland shooting. The bill is unlikely to get a hearing or vote in the GOP-controlled House and Senate, but could become a talking point during the upcoming election season.",https://www.freep.com/story/news/local/michigan/2018/06/17/democrats-new-bills-legal-voting-age-16/699459002/
2018-06-18,Michigan Gubernatorial Race,The first Democrat-only televised debate is happening this Wednesday. The three candidates will tout their agendas to a broader audience. Whitmer is expected to announce her own health care plan. ,https://www.thenewstribune.com/news/business/article213305194.html
2018-06-18,LCV ,Legislation proposing Michigan drop its stringent ballast water discharge rules and adopt federal regulations for ocean freighters was approved by the House this week. Environmentalists are urging Snyder to veto the bill over concerns of invasive species. ,https://www.detroitnews.com/story/news/local/michigan/2018/06/17/michigan-ballast-water-rules-backlash/702178002/
2018-06-19,Progress Michigan ,"Trump's zero tolerance immigration policy is a divisive topic right now, causing a rift between Republicans. It's impacts are felt in Michigan where two Michigan foster care agencies hold contracts with the federal government and are licensed to find foster homes for immigrant children separated from their families. ",https://www.freep.com/story/news/local/michigan/2018/06/19/immigrant-children-michigan-foster-care/711174002/
2018-06-19,Michigan Gubernatorial Race,"[Dem: Whitmer] Whitmer has snagged some key endorsements in her run for governor - Macomb County Sheriff,  Prosecutor and Executive have chosen to back her. ",https://www.wsjm.com/2018/06/18/key-endorsements-for-whitmer/
2018-06-19,Planned Parenthood,"Teen births have hit a record low in Michigan, as a decades-long trend downwards continues to accelerate, based on state data. Experts credit a number of factors for the decline including the use of more effective birth control. ",https://www.mlive.com/expo/news/erry-2018/06/a0b5c8e9c53544/teen_births_continue_to_plumme.html#incart_river_index
2018-06-19,LCV,"Wolverine World Wide has begun to sample soil, sediment and groundwater at their former tannery to determine how toxic the property is following an order from the EPA. Sediment testing in a nearby river found elevated levels of arsenic, lead and mercury. The site was found to have high PFA levels in November. ",http://www.mlive.com/news/grand-rapids/index.ssf/2018/06/more_contamination_testing_beg.html
2018-06-20,Michigan Gubernatorial Race,"Whitmer and El-Sayed are the first candidates to ask for public financing ahead of the primary. Schuette, Calley and Colbeck have each told the state they could make similar requests in the next seven weeks. Michigan makes public funding available to all gubernatorial candidates, who can typically qualify for up to $990,000 for the primary in a 2-1 match on donations made by state residents. ",https://www.detroitnews.com/story/news/local/michigan/2018/06/19/whitmer-abdul-public-funding-governor/711837002/
2018-06-20,Progress Michigan ,"Launch Michigan, a new effort launching in Michigan, includes more than 30 organizations representing labor, business, philanthropy, education and community. Their purpose is to support strategies that have been proven by research to deliver effective education to students, and stick with them beyond election cycles.",https://www.freep.com/story/news/education/2018/06/20/unlikely-leaders-try-fix-michigan-schools/715523002/
2018-06-20,Progress Michigan ,"Not a single teacher or member of the public spoke in favor of the proposed changes to Michigan's social studies curriculum at the listening session hosted by the Michigan Department of Education. Many were outraged at the possibility of removing mentions of Islam, civil rights efforts of minorities and the word 'democratic' from the civics adage 'core democratic values.",https://www.mlive.com/news/flint/index.ssf/2018/06/michigan_teachers_debate_propo.html
2018-06-20,Michigan Gubernatorial Race,"Tonight the Democratic candidates are debating. The three agree on many issues, like raising the minimum wage to $15 an hour, spending more on roads and other infrastructure, shutting down the pipelines in the straits and repealing the state's emergency manager law. But there are also many differences which should make for an interesting debate tonight - including their healthcare proposals and how they will approach taxes.",https://www.lansingstatejournal.com/story/news/local/michigan/2018/06/17/democrats-unveil-new-policies-before-gubernatorial-primary/708536002/
2018-06-20,Progress Michigan ,"Michigan Department of Civil Rights releases a statement regarding the zero tolerance immigration policy after receiving an influx of children from the border, some as young as 3 months of age. In the statement they describe their opposition to the forced separation of children from their parents. ",https://www.detroitnews.com/story/news/local/michigan/2018/06/20/michigan-sees-young-children-separated-parents/717672002/
2018-06-21,Michigan Gubernatorial Race,"Summary of Democratic Debate:  Candidates found common ground on a number of topics - shutting down line 5, legalizing marijuana and ending family separation at the border (*which Trump ended Wednesday). Candidates discussed different approaches to healthcare, how they would pay to fix Michigan's infrastructure problems and how to improve gun control. Whitmer had a strong performance. ",https://www.detroitnews.com/story/news/local/michigan/2018/06/20/whitmer-el-sayed-thanedar-debate-michigan-governor-democrats/718743002/
2018-06-21,Michigan Gubernatorial Race,"[Rep: Schuette] Michigan GOP addressed an email sent out that appeared to show the state party supporting Scheutte's run for governor, stating the email was sent out with MRP's knowledge. The Michigan Republican Party does not endorse in open and contested primaries. ",https://www.detroitnews.com/story/news/local/michigan/2018/06/21/michigan-republican-chairman-disavow-schuette-email/719480002/
2018-06-21,Michigan Gubernatorial Race,"[Rep: Schuette] Schuette has released an attack ad on Calley, targeting his time at Harvard as ""wasting taxpayers time and money"". The ad said Calley, who serves as president over the Senate, collected his roughly $123,900 salary while missing one-third of Senate session days in 2013 and 2014.",https://www.detroitnews.com/story/news/local/michigan/2018/06/21/michigan-republican-chairman-disavow-schuette-email/719480002/
2018-06-21,Michigan Gubernatorial Race,"[Rep: Calley]  Calley came out with a new ad featuring two victims of former Michigan State University sports doctor Larry Nassar. In the 30-second commercial released less than a week after Calley signed sexual assault statute of limitation extensions into law, victims of Nasser praised Calley who “listened,” “while some politicians grandstanded.”",https://www.detroitnews.com/story/news/local/michigan/2018/06/21/michigan-republican-chairman-disavow-schuette-email/719480002/
2018-06-21,Progress Michigan ,"Hundreds of gun rights activists from across Michigan gathered at the Capitol yesterday to demonstrate their right to openly carry their guns and advocate for protecting the Second Amendment during the annual Second Amendment March. Schuette, Calley and Colbeck were all in attendance and spoke at the event. ",https://www.mlive.com/expo/news/erry-2018/06/f1e78e28087335/hundreds_of_gun_carrying_michi.html
2018-06-22,Planned Parenthood,"The 2019 state budget signed by Snyder won't shift federal money for pregnancy prevention and family planning services away from Planned Parenthood. The budget, which had been approved by the Legislature, would have moved federal Title X money for family planning services to health clinics and county health departments that do not provide abortions.",https://www.freep.com/story/news/2018/06/22/planned-parenthood-budget/722675002/
2018-06-22,Planned Parenthood,Though research has shown that abstinence-only sex education is highly ineffective — and can even be harmful — there are schools across the country that continue to teach it. Planned Parenthood has now filed a lawsuit against the Department of Health and Human Services official responsible for pushing abstinence-only education on American students.,https://hellogiggles.com/news/planned-parenthood-suing-valerie-huber-abstinence-only-sex-ed-trump/
2018-06-22,Progress Michigan ,"Michigan officials claim they have no involvement in tracking 54 immigrant children placed in foster care in the state after being separated from their families at the U.S.-Mexico border. Snyder made a statement that no state agency has been provided with names, ages or any other identifying information about the children, so they are ""unable to track where they are placed or how they are cared for.""",https://www.mlive.com/news/index.ssf/2018/06/state_claims_it_cant_track_54.html
2018-06-22,Progress Michigan ,Protests against immigration tactics under Trump are being planned throughout the state of Michigan. There has been bipartisan backlash to family separation and a large number of Republicans have opposed Trump on the policy. ,https://www.mlive.com/news/index.ssf/2018/06/family_separation_protests_pla.html#incart_river_index
2018-06-25,Progress Michigan ,"Michigan energy suppliers say proposed actions by the Trump administration to declare an energy state of emergency are unnecessary and could lead to higher electric bills for customers. Trump is moving to slow the shutdown of nuclear and coal power plants, making good on his campaign promise to save the coal industry. ",https://www.detroitnews.com/story/business/2018/06/25/donald-trump-energy-department-coal-nuclear-energy-michigan-residents/704012002/
2018-06-25,Michigan Gubernatorial Race,"[Dem: Thanedar] David Bullock, a pastor and lead campaign manager for Thanedar was arrested Sunday for allegedly interfering with a police investigation. In a statement Thanedar said he supported Bullock and demanded an investigation of the officers involved in the arrest.",https://www.detroitnews.com/story/news/local/michigan/2018/06/25/highland-park-pastor-thanedar-campaign-manager-arrested/730090002/
2018-06-25,Michigan Gubernatorial Race,"Reminder: Thursday, June 28, WDIV-Local 4 and the Michigan Republican Party will host ""Decision 2018: Republican Gubernatorial Debate"" with the four leading GOP candidates for Michigan governor. ",https://www.clickondetroit.com/michigan-elections/watch-michigan-democratic-debate-for-governor
2018-06-25,Michigan Gubernatorial Race,"[Dem: Whitmer] The Michigan Republican Party has asked officials to investigate whether the group Build a Better Michigan violated state campaign finance laws by running $1.8 million in television ads that feature Whitmer. The GOP argues that the ads go beyond ""issue advocacy"" by identifying Whitmer as a candidate for governor. ",https://www.detroitnews.com/story/news/local/michigan/2018/06/20/michigan-gop-complaint-whitmer-ad/718870002/
2018-06-25,Progress Michigan ,"A 2016 report commissioned by Snyder estimated a nearly $4 billion annual investment gap on addressing infrastructure improvements and maintenance in the state, but little has been done since then to seriously address the gap. This article provides a more in depth look at road, broadband and water system issues in Michigan. ",https://www.mlive.com/news/index.ssf/2018/06/michigan_beyond_infrastructure.html#incart_river_index
2018-06-25,Michigan Gubernatorial Race,"[Dem: Thanedar] An interesting look at the similarities  in Thanedar's running tactics and those of Trump: ""A wealthy first-time candidate prone to lofty, unverifiable claims vaulting to the top of the polls in a high-profile race by wrapping himself in the cloak of a movement he had little connection to before his campaign launch."" ",https://www.politico.com/magazine/story/2018/06/24/shri-thanedar-profile-michigan-governor-2018-218831
2018-06-26,Progress Michigan ,"Snyder signs Medicaid Work Bill into law, requires able-bodied adults to show workforce engagement averaging 80 hours a month, such as a job, school, vocational training, an internship, substance abuse treatment or community service.",https://www.freep.com/story/news/politics/2018/06/22/medicaid-work-requirement-michigan/726809002/
2018-06-26,Michigan Gubernatorial Race,"Round up of political ads: Whitmer's first TV ad began airing yesterday - touching on things like raising minimum wage, expanding Medicaid and ""fixing the damn roads."" Hines releases a number of animated online videos, one depicts Calley and Schuette as swamp creatures. Schuette and Calley continue to run attack ads against each other. ",https://www.mlive.com/expo/news/erry-2018/06/e1a3ec16149944/gretchen_whitmer_up_with_first.html#incart_river_index
2018-06-26,Progress Michigan ,"Protesters gathered outside ICE office in Detroit yesterday with the hope of shutting it down. The protest is one of several ""Occupy ICE"" demonstrations that have popped up around the country in the wake of the zero tolerance immigration policy.",https://www.metrotimes.com/news-hits/archives/2018/06/25/occupy-ice-protesters-attempt-to-shut-down-detroit-office
2018-06-27,Planned Parenthood,"Supreme Court sides with Crisis Pregnancy Centers in ruling that blocks a California law requiring these centers share basic information about the availability of family planning services, prenatal care, and abortion. ",https://www.cnn.com/2018/06/26/politics/supreme-court-abortion-california-ruling/index.html
2018-06-27,Progress Michigan ,Supreme Court upholds Trump's travel ban from predominantly Muslim countries - the decision is a big win for the administration. ,https://www.nbcnews.com/politics/supreme-court/supreme-court-upholds-trump-travel-ban-n873441
2018-06-27,Progress Michigan ,Democrats in the state House want to get rid of a law passed by Schuette that protects drug companies that knowingly make or sell harmful drugs. Michigan has been in an opioid crisis for years and many Michigan communities are in the middle of lawsuits against opioid makers. ,http://michiganradio.org/post/house-democrats-introduce-plan-repeal-drug-liability-law
2018-06-27,Progress Michigan ,"A township in Southwest Michigan, Oshtemo, has passed a resolution denouncing the indefinite detention of families at the southern U.S. border. The resolution carries no legal weight, but asks the federal government to treat all people respectfully and humanely regardless of citizenship, immediately reunite families separated at the border, respect due process and cease discrimination based on religion.",https://www.mlive.com/news/kalamazoo/index.ssf/2018/06/michigan_township_denounces_de.html#incart_river_index
2018-06-27,Michigan Gubernatorial Election,"Schuette has launched a petition in support of the Supreme Court ruling to uphold Trump's travel ban, tweeting: ""Yesterday, the Supreme Court upheld President Trump's authority to secure our borders and provide the necessary safety to Americans that has been ignored by past administrations. Join me in supporting this important decision by signing my petition today.""",https://twitter.com/SchuetteOnDuty/status/1012022762473512960
2018-06-28,Michigan Gubernatorial Race,"[Dem: Whitmer] An in depth article looking at Whitmer positing her as the establishment front runner for the Democratic nomination since she has secured endorsements of most traditional unions and party leaders. However, her polling lead has evaporated in her wait to run television ads. ",https://www.detroitnews.com/story/news/local/michigan/2018/06/27/gretch-whitmer-profile-michigan-governor/698088002/
2018-06-28,Michigan Gubernatorial Race,[Rep: Schuette] Schuette is seeking to stop a proposal on the November ballot that aims to alter how the state draws political boundaries. The proposal would create an independent redistricting commission to redraw congressional and legislative maps every 10 years. ,https://www.detroitnews.com/story/news/local/michigan/2018/06/26/schuette-redistricting-proposal-ballot/736710002/
2018-06-28,Progress Michigan ,"Supreme Court makes ruling in Janus case - government workers who choose not to join a union cannot be charged for the cost of collective bargaining. Michigan, and Schuette, sided with Janus in the case. The decision overrules a 40-year-old precedent in a Michigan case, Abood v. Detroit Board of Education, which unanimously upheld mandatory public-sector union fees. ",https://www.detroitnews.com/story/news/local/michigan/2018/06/27/supreme-court-ruling-union-fees/690076002/
2018-06-28,Progress Michigan ,"Protesters shut down a Kent County commission meeting in an attempt to address the board about on an ICE contract with the Kent County Jail. The contract, signed in 2012 and renewed in late 2017, allows the jail to charge ICE for each day it holds a person with a detainment request. They can be held for up to 3 days until ICE officers pick them up for possible immigration proceedings.",https://www.mlive.com/news/grand-rapids/index.ssf/2018/06/ice_protesters_shut_down_kent.html#incart_river_index
2018-06-28,Michigan Gubernatorial Race,"[Dem: Thanedar] Thanedar has released three new ads to air across Michigan. The subjects of these ads are: the influence of big money in Lansing, voter apathy towards establishment candidates, and Michigan's crumbling infrastructure. ",https://www.prnewswire.com/news-releases/democratic-gubernatorial-candidate-shri-thanedar-launches-new-tv-ads-in-markets-across-michigan-300674033.html
2018-06-29,Michigan Gubernatorial Race,"Republican candidates for governor on Thursday took the stage for a final pre-primary debate, fielding questions on tax incentives and how to fix the roads without raising taxes. Calley, Colbeck and Hines attached Schuette, while Schuette attached Dems.",https://www.mlive.com/news/index.ssf/2018/06/republicans_governor_candidate.html
2018-06-29,Michigan Gubernatorial Race,"Protesters slam GPO on healthcare, wages at Michigan governor debate. Bill Schuette, Michigan's attorney general, was the main focus of protesters’ vitriol. Schuette has pledged to roll back Michigan’s Medicaid expansion if elected and has publicly opposed the Affordable Care Act.",https://www.freep.com/story/news/local/michigan/detroit/2018/06/28/protests-michigan-republican-governor-debate/744139002/
2018-06-29,Michigan Gubernatorial Race,[Rep: Schuette]: The attorney who defended former state representative Cindy Gamrat on criminal official misconduct charges on Thursday calls for grand jury investigation of Attorney General Bill Schuette. ,https://www.freep.com/story/news/local/michigan/2018/06/28/bill-schuette-investigation-michael-nichols/742703002/
2018-06-29,Progress Michigan,Infrastructure in Michigan continues to be a source of contention for residents across the state. The state Legislature laid out plans in 2015 to commit up to $1.2 billion in additional infrastructure funding by 2021. Part of that funding plan relies on commitments from the state's general fund budget each year.,https://www.mlive.com/expo/news/erry-2018/06/b10c6c491b3128/michigan_beyond_infrastructure.html#incart_river_index
2018-06-29,Progress Michigan,"Outgoing Gov. Rick Snyder has signed a $16.8 billion education budget that includes a sizable increase in base aid for lower-funded K-12 districts in Michigan. Democrats had rejected the proposed budget in the GOP-controlled Legislature, saying it won't be enough to reverse course in Michigan's most cash-strapped districts.",http://www.uppermichiganssource.com/content/news/Snyder-education-budget-grants-nearly-17-billion-to-schools-486917491.html
2018-06-29,Progress Michigan,"Michigan ranks 33rd in the country for overall child well-being (issues including low reading levels, poverty rates, and available access to healthcare). In Michigan, 17% of children lived in poverty in 2016. Teens not in school and not working hit 53% in the state.",https://patch.com/michigan/detroit/michigan-ranks-toward-bottom-u-s-child-well-being
2018-06-29,LCV,"Enbridge Energy Partners has delivered to the State of Michigan three reports that examine possible measures and technologies to mitigate potential leaks from Line 5 in the Straits of Mackinac and at water crossings throughout Michigan. The reports include: Assess technologies that will provide additional leak and coating damage detection benefits over and above technologies, Study options to mitigate the risk of a vessel anchor damaging Line 5 in the straits, List priority waters crossed by Line 5 and assess measures at each crossing to minimize the likelihood and consequences of a spill. ",https://www.upmatters.com/news/local-news/enbridge-submits-final-3-reports-to-state-of-michigan-on-line-5/1273308097
2018-07-02,Michigan Gubernatorial Race,"[Dem: Whitmer] Gretchen Whitmer pulls way ahead in latest governor's race poll. Michigan Information & Research Service (MIRS) puts Whitmer at 40%, with Thanedar and El-Sayed at 19% and 17% respectively. The poll was conducted by phone (28% calls to mobile devices) between June 24 and 26.",https://www.metrotimes.com/news-hits/archives/2018/07/02/gretchen-whitmer-pulls-way-ahead-in-latest-governors-race-poll
